{
  "schema_version": "1.0.0",
  "scenario_id": "D10-policy-fingerprint",
  "use_case_ids": [
    "D10"
  ],
  "purpose": "policy changes fingerprint",
  "request_file": "request.json",
  "policy_file": "policy.json",
  "expected_file": "expected.json",
  "required_reason_codes": [
    "CLASS_MATCH"
  ],
  "catalog_inputs": [
    {
      "file": "../shared/catalog-main.json",
      "catalog_record_id": "record-main"
    }
  ]
}
