{
  "schema_version": "1.0.0",
  "scenario_id": "D3-pressure-equivalent",
  "use_case_ids": [
    "D3"
  ],
  "purpose": "higher pressure class",
  "request_file": "request.json",
  "policy_file": "policy.json",
  "expected_file": "expected.json",
  "required_reason_codes": [
    "EQUIVALENT_RULE_APPLIED"
  ],
  "catalog_inputs": [
    {
      "file": "catalog.json",
      "catalog_record_id": "record-main"
    }
  ]
}
