{
  "schema_version": "1.0.0",
  "scenario_id": "identity-neq-hard",
  "use_case_ids": [
    "D5"
  ],
  "purpose": "negative identity remains hard",
  "request_file": "request.json",
  "policy_file": "policy.json",
  "expected_file": "expected.json",
  "required_reason_codes": [
    "IDENTITY_EXCLUDED"
  ],
  "catalog_inputs": [
    {
      "file": "catalog.json",
      "catalog_record_id": "record-main"
    }
  ]
}
