{
  "schema_version": "1.0.0",
  "scenario_id": "D4-handle-alternative",
  "use_case_ids": [
    "D4"
  ],
  "purpose": "handle alternative",
  "request_file": "request.json",
  "policy_file": "policy.json",
  "expected_file": "expected.json",
  "required_reason_codes": [
    "ATTRIBUTE_DIFFERENCE",
    "ALTERNATIVE_RULE_APPLIED"
  ],
  "catalog_inputs": [
    {
      "file": "../shared/catalog-main.json",
      "catalog_record_id": "record-main"
    }
  ]
}
