{
  "schema_version": "1.0.0",
  "scenario_id": "C10-review-excluded",
  "use_case_ids": [
    "C10"
  ],
  "purpose": "review item excluded",
  "request_file": "request.json",
  "policy_file": "policy.json",
  "expected_file": "expected.json",
  "required_reason_codes": [
    "CATALOG_ITEM_NEEDS_REVIEW"
  ],
  "catalog_inputs": [
    {
      "file": "catalog.json",
      "catalog_record_id": "record-main"
    }
  ]
}
