{
  "schema_version": "1.0.0",
  "scenario_id": "D6-brand-excluded",
  "use_case_ids": [
    "D6"
  ],
  "purpose": "excluded brand",
  "request_file": "request.json",
  "policy_file": "policy.json",
  "expected_file": "expected.json",
  "required_reason_codes": [
    "BRAND_EXCLUDED"
  ],
  "catalog_inputs": [
    {
      "file": "../shared/catalog-main.json",
      "catalog_record_id": "record-main"
    }
  ]
}
