{
  "schema_version": "1.0.0",
  "scenario_id": "D3-brand-equivalent",
  "use_case_ids": [
    "D3"
  ],
  "purpose": "brand substitution",
  "request_file": "request.json",
  "policy_file": "policy.json",
  "expected_file": "expected.json",
  "required_reason_codes": [
    "IDENTITY_DIFFERENCE",
    "EQUIVALENT_RULE_APPLIED"
  ],
  "catalog_inputs": [
    {
      "file": "../shared/catalog-main.json",
      "catalog_record_id": "record-main"
    }
  ]
}
